In some respects all of my health is my personal business.  I am not comfortable sharing it until I know the people and the environment.  As long as I can be honest with myself and feel that work will not be affected.,Again I need to feel comfortable with those around me first.  When treated properly my mental health does not affect my work.,I spoke with the head of HR regarding a mental health issue and the coverages the company provided to help me cover the costs.  She was very supportive and continues to check in on me from time to time.,"Will co-workers I trust I will discuss some of the more ""simple"" aspects of my mental health.   I don't mind talking about anxiety or mentioning that I speak to a therapist, but I generally will not go past that.","Someone who reports to me has described depression and anxiety with me.  It has, rarely, but has affected his ability to come to work.  I shared with him my experiences in the hope that he would feel that I can empathize with him and that its a safe place to discuss it if he needs help.",,,,Make sure that mental health options are clearly outlined in employee benefits literature.  Provide employees a safe place to talk if need be like an EAP.  Provide quiet rooms and personal spaces to find time to relax.,,,respect health personal business comfortable sharing know people environment long honest feel work affected,need feel comfortable around first treated properly mental health affect work,spoke head hr regarding mental health issue coverage company provided help cover cost supportive continues check time time,coworkers trust discus simple aspect mental health dont mind talking anxiety mentioning speak therapist generally go past,someone report described depression anxiety rarely affected ability come work shared experience hope would feel empathize safe place discus need help,,,,make sure mental health option clearly outlined employee benefit literature provide employee safe place talk need like eap provide quiet room personal space find time relax,,,respect health personal business comfortable sharing know people environment long honest feel work affected need feel comfortable around first treated properly mental health affect work spoke head hr regarding mental health issue coverage company provided help cover cost supportive continues check time time coworkers trust discus simple aspect mental health dont mind talking anxiety mentioning speak therapist generally go past someone report described depression anxiety rarely affected ability come work shared experience hope would feel empathize safe place discus need help    make sure mental health option clearly outlined employee benefit literature provide employee safe place talk need like eap provide quiet room personal space find time relax  ,0.9914,Positive,Uruguay
"If it is not effecting my job, I see not point in bringing it up. ","If it is not effecting my job, I see no point in bringing it up. ",,,okay,,,,I don't have a mental health issue so I am unsure. ,,no,effecting job see point bringing,effecting job see point bringing,,,okay,,,,dont mental health issue unsure,,,effecting job see point bringing effecting job see point bringing   okay    dont mental health issue unsure  ,-0.0258,Neutral,United States of America
It might impact if I were to be hired or not.,It's way too personal.,I needed to take time off of work due to a traumatic event that made my mental health much worse. They were very supportive.,"I have conversations in passing, referring to anxiety  most often.",We shared our experiences with depression and anxiety via Slack DMs. I've done this with several people.,"I was disclosing why I had to leave, and that the job severely impacted my mental health. It went poorly.",We shared our mutual experiences with mental health,,,,,might impact hired,way personal,needed take time work due traumatic event made mental health much worse supportive,conversation passing referring anxiety often,shared experience depression anxiety via slack dm ive done several people,disclosing leave job severely impacted mental health went poorly,shared mutual experience mental health,,,,,might impact hired way personal needed take time work due traumatic event made mental health much worse supportive conversation passing referring anxiety often shared experience depression anxiety via slack dm ive done several people disclosing leave job severely impacted mental health went poorly shared mutual experience mental health    ,-0.8779,Negative,United States of America
Discrimination is a thing.,Discrimination is a thing.,,,,,,,Manager training to understand mental illness and how to respond in at least a non-toxic way. Understanding for work accomdations (i.e. WFH).,Victim blaming. Removing responsibility from the person.,Men causing or exacerbating mental health issues URM developers have needs to be talked about.,discrimination thing,discrimination thing,,,,,,,manager training understand mental illness respond least nontoxic way understanding work accomdations ie wfh,victim blaming removing responsibility person,men causing exacerbating mental health issue urm developer need talked,discrimination thing discrimination thing       manager training understand mental illness respond least nontoxic way understanding work accomdations ie wfh victim blaming removing responsibility person men causing exacerbating mental health issue urm developer need talked,-0.7906,Negative,United States of America
I want to get the accommodations that I need to do my job well. Cannot get those if you are not honest.,"If I need accommodations in the future, I don't want my employer to think I am lying. If I tell them proactively, they cannot claim later that they did not know this was a legit issue for me",supportive,"supportive, empathetic","stressful, they were exhausted, happy they were not alone","skeptical, friendly to my face but I don't think they believed me behind my back","mixed, some skeptical some supportive. Many had a ""suck it up"" attitutde","stressed, exhausted, felt like I had to take on their burden",,"Not fully informed of accommodations and benefits I was entitled to, pressure to come back to work before ready",,want get accommodation need job well get honest,need accommodation future dont want employer think lying tell proactively claim later know legit issue,supportive,supportive empathetic,stressful exhausted happy alone,skeptical friendly face dont think believed behind back,mixed skeptical supportive many suck attitutde,stressed exhausted felt like take burden,,fully informed accommodation benefit entitled pressure come back work ready,,want get accommodation need job well get honest need accommodation future dont want employer think lying tell proactively claim later know legit issue supportive supportive empathetic stressful exhausted happy alone skeptical friendly face dont think believed behind back mixed skeptical supportive many suck attitutde stressed exhausted felt like take burden  fully informed accommodation benefit entitled pressure come back work ready ,0.5945,Positive,United States of America
i dont want to be pigeonholed,I dont want to be pigeonholed,,,they talked about going to therapy,,,,realize when treated a person will provide good work and when it isnt treated the company will spend more money on sick time and ok work,Noticed those people dont seem to move up,,dont want pigeonholed,dont want pigeonholed,,,talked going therapy,,,,realize treated person provide good work isnt treated company spend money sick time ok work,noticed people dont seem move,,dont want pigeonholed dont want pigeonholed   talked going therapy    realize treated person provide good work isnt treated company spend money sick time ok work noticed people dont seem move ,0.0915,Positive,United States of America
Would likely only bring it up if it would impact my job performance.,Wouldn't want to work for an employer who isn't cool with my diagnosis. I'm very privileged that I have many work options available.,,,,,,,We could talk about it. We could stop having businesses that have crunch times. We could make it easier for folks to know what mental health options are available. We could stop stigmatising mental health as a society.,,,would likely bring would impact job performance,wouldnt want work employer isnt cool diagnosis im privileged many work option available,,,,,,,could talk could stop business crunch time could make easier folk know mental health option available could stop stigmatising mental health society,,,would likely bring would impact job performance wouldnt want work employer isnt cool diagnosis im privileged many work option available       could talk could stop business crunch time could make easier folk know mental health option available could stop stigmatising mental health society  ,0.0299,Neutral,United States of America
"If I thought I was otherwise qualified for the job, and revealing the health issue would not increase my chances of getting the job, then I wouldn't bother revealing it. What would be the possible upside of that decision?","Too much stigma in society, too few people trained not to fear it, too many undiagnosed people judging those who have been diagnosed.",,Spoke about anxiety. Shared stories with each other. There was acceptance all around. ,,,"Very limited. Most information shared was after we stopped working together. Information shared while we worked together was about friends and family in the abstract, and not specific to any diagnosis or issues that were current at the time. ",,"Meaningful support, at a minimum, in the form of acknowledging mental health and encouraging a non-stigmatized attitude toward mental health issues.",,,thought otherwise qualified job revealing health issue would increase chance getting job wouldnt bother revealing would possible upside decision,much stigma society people trained fear many undiagnosed people judging diagnosed,,spoke anxiety shared story acceptance around,,,limited information shared stopped working together information shared worked together friend family abstract specific diagnosis issue current time,,meaningful support minimum form acknowledging mental health encouraging nonstigmatized attitude toward mental health issue,,,thought otherwise qualified job revealing health issue would increase chance getting job wouldnt bother revealing would possible upside decision much stigma society people trained fear many undiagnosed people judging diagnosed  spoke anxiety shared story acceptance around   limited information shared stopped working together information shared worked together friend family abstract specific diagnosis issue current time  meaningful support minimum form acknowledging mental health encouraging nonstigmatized attitude toward mental health issue  ,0.9548,Positive,United States of America
It's a negative concern,"In an interview? If you're trying to get a job, the last thing you want to do is throw red flags. I suppose I would ask something along the lines of, how important is openness re: mental health in this workplace",,One of my coworkers studied in a Buddhist monastery for a period of time. I meditate and am generally interested in awareness and the value of mental health. We've discussed our different views and practices for meditation and mindfulness,,,"A very good friend that also struggled with depression ,eating disorders, etc, very helpful and open",same as above,,,,negative concern,interview youre trying get job last thing want throw red flag suppose would ask something along line important openness mental health workplace,,one coworkers studied buddhist monastery period time meditate generally interested awareness value mental health weve discussed different view practice meditation mindfulness,,,good friend also struggled depression eating disorder etc helpful open,,,,,negative concern interview youre trying get job last thing want throw red flag suppose would ask something along line important openness mental health workplace  one coworkers studied buddhist monastery period time meditate generally interested awareness value mental health weve discussed different view practice meditation mindfulness   good friend also struggled depression eating disorder etc helpful open    ,0.6124,Positive,United States of America
I'd be afraid that mentioning a disability so early on would make them see me as high maintenance.,I'd be afraid that mentioning a disability so early on would make them see me as high maintenance.,"I've shared my diagnosis, what challenges I face, the coping mechanisms I have, and new coping mechanisms I'm working on.","I've shared my diagnosis, what challenges I face, the coping mechanisms I have, and new coping mechanisms I'm working on.",,"I've shared my diagnosis, what challenges I face, the coping mechanisms I have, and new coping mechanisms I'm working on.",,,Normalize it. Encourage healthy work/life balance. Discourage hero culture.,Lack of empathy and understanding. Minimizing and questioning the validity.,,id afraid mentioning disability early would make see high maintenance,id afraid mentioning disability early would make see high maintenance,ive shared diagnosis challenge face coping mechanism new coping mechanism im working,ive shared diagnosis challenge face coping mechanism new coping mechanism im working,,ive shared diagnosis challenge face coping mechanism new coping mechanism im working,,,normalize encourage healthy worklife balance discourage hero culture,lack empathy understanding minimizing questioning validity,,id afraid mentioning disability early would make see high maintenance id afraid mentioning disability early would make see high maintenance ive shared diagnosis challenge face coping mechanism new coping mechanism im working ive shared diagnosis challenge face coping mechanism new coping mechanism im working  ive shared diagnosis challenge face coping mechanism new coping mechanism im working   normalize encourage healthy worklife balance discourage hero culture lack empathy understanding minimizing questioning validity ,0.9042,Positive,United States of America
"I'm not sure, I've never had one to disclose, so I'm not sure how I'd feel about it. I guess if it interfered with the job role I took on, I would disclose it","There's still a lot of stigma, I don't want to be unfairly judged. I don't want to look like I'm being overdramatic/oversharing by bringing it up in an interview. ","He'd been only coming to my desk to criticise my work, and we hadn't had a non-work related chat in a while. I let him know that as I suffer from depression with a side plate of SAD, I was struggling with this kind of interaction and I needed more praise/positive attention. He was very understanding and changed his actions accordingly.","We have many, many conversations about mental health as both myself and another coworker suffer from anxiety disorders and depression, and we've discussed with the wider workplace how to have a more mentally healthy workplace. We also have a mental health channel in our Slack.","Many conversations, often. Not sleeping well because of anxiety, having had to take leave at their last place because of anxiety and depression etc. And we have a mental-health channel on Slack to discuss day-to-day mental health.",,"I was suffering from a major depressive episode while working in retail, lots of my coworkers realised it before I did and reached out to check if I was okay",,"More outreach, more understanding of limitations (too many job adverts that list going above and beyond/being a ""rockstar"" etc. which is inaccessible to people who need time to decompress and need periods of less stress between projects). More openness in general.",,"I'm from the UK, which is fairly different (since we don't have health insurance)",im sure ive never one disclose im sure id feel guess interfered job role took would disclose,there still lot stigma dont want unfairly judged dont want look like im overdramaticoversharing bringing interview,hed coming desk criticise work hadnt nonwork related chat let know suffer depression side plate sad struggling kind interaction needed praisepositive attention understanding changed action accordingly,many many conversation mental health another coworker suffer anxiety disorder depression weve discussed wider workplace mentally healthy workplace also mental health channel slack,many conversation often sleeping well anxiety take leave last place anxiety depression etc mentalhealth channel slack discus daytoday mental health,,suffering major depressive episode working retail lot coworkers realised reached check okay,,outreach understanding limitation many job advert list going beyondbeing rockstar etc inaccessible people need time decompress need period less stress project openness general,,im uk fairly different since dont health insurance,im sure ive never one disclose im sure id feel guess interfered job role took would disclose there still lot stigma dont want unfairly judged dont want look like im overdramaticoversharing bringing interview hed coming desk criticise work hadnt nonwork related chat let know suffer depression side plate sad struggling kind interaction needed praisepositive attention understanding changed action accordingly many many conversation mental health another coworker suffer anxiety disorder depression weve discussed wider workplace mentally healthy workplace also mental health channel slack many conversation often sleeping well anxiety take leave last place anxiety depression etc mentalhealth channel slack discus daytoday mental health  suffering major depressive episode working retail lot coworkers realised reached check okay  outreach understanding limitation many job advert list going beyondbeing rockstar etc inaccessible people need time decompress need period less stress project openness general  im uk fairly different since dont health insurance,-0.9809,Negative,United States of America
"Depends what it is. If I would need different working environment etc. then yes, if not no.","Again, depends what it is if I'd need adjustments made to work environment or anything.",,,,,,,,,,depends would need different working environment etc yes,depends id need adjustment made work environment anything,,,,,,,,,,depends would need different working environment etc yes depends id need adjustment made work environment anything         ,0.4019,Positive,United States of America
I expect that discussing a physical health issue would have a somewhat negative impact on my chance of getting the job.,I expect that discussing a mental health issue would guarantee a negative impact on my chance of getting the job.,"I told my manager that the pressures of my work, combined with family medical stress, was interfering with my ability to work. 

His reaction was to suggest that I look for a different job within the company until the medical issues were ""dealt with""",,,,,,Evaluate team performance instead of individuals.,Manager told me to work harder or find another job.,,expect discussing physical health issue would somewhat negative impact chance getting job,expect discussing mental health issue would guarantee negative impact chance getting job,told manager pressure work combined family medical stress interfering ability work reaction suggest look different job within company medical issue dealt,,,,,,evaluate team performance instead individual,manager told work harder find another job,,expect discussing physical health issue would somewhat negative impact chance getting job expect discussing mental health issue would guarantee negative impact chance getting job told manager pressure work combined family medical stress interfering ability work reaction suggest look different job within company medical issue dealt      evaluate team performance instead individual manager told work harder find another job ,-0.722,Negative,United Kingdom
"Physical issues are traditionally easier to accomodate and I could prove that I can still do the job while having physical health issues.  It's way harder to ask for mental accomodations without couching them in certain ways, and I usually ask about them in the context of general benefits",People are aggressively biased against it and accomodations are harder to get,Briefly discussed my anxiety diagnosis; manager was understanding and we discussed ways I can manage that with a flexible work environment program,,"Discussed issues with a coworker friend who also has issues, we traded advice mostly",,,,Good healthcare benefits and work accomodations with no bias against them (such as allowing people to work remote more often if needed) - also training people to have some empathy towards their coworkers,Coworkers were derogatory towards people and received no reprimand,,physical issue traditionally easier accomodate could prove still job physical health issue way harder ask mental accomodations without couching certain way usually ask context general benefit,people aggressively biased accomodations harder get,briefly discussed anxiety diagnosis manager understanding discussed way manage flexible work environment program,,discussed issue coworker friend also issue traded advice mostly,,,,good healthcare benefit work accomodations bias allowing people work remote often needed also training people empathy towards coworkers,coworkers derogatory towards people received reprimand,,physical issue traditionally easier accomodate could prove still job physical health issue way harder ask mental accomodations without couching certain way usually ask context general benefit people aggressively biased accomodations harder get briefly discussed anxiety diagnosis manager understanding discussed way manage flexible work environment program  discussed issue coworker friend also issue traded advice mostly    good healthcare benefit work accomodations bias allowing people work remote often needed also training people empathy towards coworkers coworkers derogatory towards people received reprimand ,0.8586,Positive,Serbia
I feel I have enough bias against me as it is so I would be hesitant,I don't think potential employers want to hire people who say they have mental health issues,,I discussed diagnoses and they seemed generically supportive. ,They mentioned they might have a particular diagnosis and might seek treatment,,I talked about possibilities but nothing definite because they didn't seem that receptive,,"Actively talk about it as just a normal part, similar to (physical) wellness programs",Causing stress responses in other people,,feel enough bias would hesitant,dont think potential employer want hire people say mental health issue,,discussed diagnosis seemed generically supportive,mentioned might particular diagnosis might seek treatment,,talked possibility nothing definite didnt seem receptive,,actively talk normal part similar physical wellness program,causing stress response people,,feel enough bias would hesitant dont think potential employer want hire people say mental health issue  discussed diagnosis seemed generically supportive mentioned might particular diagnosis might seek treatment  talked possibility nothing definite didnt seem receptive  actively talk normal part similar physical wellness program causing stress response people ,-0.3769,Negative,United Kingdom
"It depends on the physical health issue and how it would interact with the job. Generally speaking, no, but if I needed accommodations, yes.","Similarly, if I needed accommodations, I would be more likely to. I feel I'd be less likely to discuss a mental health issue, but I've not had a severe mental or physical health issue to know how I'd act for sure.",,,,,,,"I have seen it become a more openly discussed issue; not just through OSMI, but other people that I know both personally and as public personas discuss how the tech industry handles mental health issues.",,nothing,depends physical health issue would interact job generally speaking needed accommodation yes,similarly needed accommodation would likely feel id less likely discus mental health issue ive severe mental physical health issue know id act sure,,,,,,,seen become openly discussed issue osmi people know personally public persona discus tech industry handle mental health issue,,nothing,depends physical health issue would interact job generally speaking needed accommodation yes similarly needed accommodation would likely feel id less likely discus mental health issue ive severe mental physical health issue know id act sure       seen become openly discussed issue osmi people know personally public persona discus tech industry handle mental health issue  nothing,0.34,Positive,United States of America
It would depend on how relevant it was to the role. ,,,,,,,,Continue to reduce stigma. Particularly bad amongst older developers where there’s a cultural difference. ,,,would depend relevant role,,,,,,,,continue reduce stigma particularly bad amongst older developer there cultural difference,,,would depend relevant role        continue reduce stigma particularly bad amongst older developer there cultural difference  ,-0.5849,Negative,United States of America
