Would be worried it would be held against me ,,,,,,,,,,,would worried would held,,,,,,,,,,,would worried would held          ,-0.296,Negative,United States of America
It's not professional,It's not professional,He was supportive but wonder about long-term implications.,,He worked for me and told him I understood and tried to be supportive.,Told them many specifics of my illness and impacts on my job. Eventually fired because of mental health issues.,Discussed my struggle at large company meeting.,Addiction and mental health conversations,"Awareness. Unfortunately, the state of the art in mental health medicine itself is many, many decades behind physical.health. So it is hard to judge employers having a progressive approach when the medical institution is so backwards.",Addiction and how it was handled,,professional,professional,supportive wonder longterm implication,,worked told understood tried supportive,told many specific illness impact job eventually fired mental health issue,discussed struggle large company meeting,addiction mental health conversation,awareness unfortunately state art mental health medicine many many decade behind physicalhealth hard judge employer progressive approach medical institution backwards,addiction handled,,professional professional supportive wonder longterm implication  worked told understood tried supportive told many specific illness impact job eventually fired mental health issue discussed struggle large company meeting addiction mental health conversation awareness unfortunately state art mental health medicine many many decade behind physicalhealth hard judge employer progressive approach medical institution backwards addiction handled ,-0.7906,Negative,United States of America
Fear of discrimination,Fear of discrimination,,,,,They were supportive and understanding,It's happened too many times to count. I was supportive and ensured they were getting the right kind of help,More awareness; inclusivity; better business practices,,,fear discrimination,fear discrimination,,,,,supportive understanding,happened many time count supportive ensured getting right kind help,awareness inclusivity better business practice,,,fear discrimination fear discrimination     supportive understanding happened many time count supportive ensured getting right kind help awareness inclusivity better business practice  ,0.7184,Positive,Norway
It could be a condition of employment to be able bodied,Nothing good would come of it. Risks far outweigh the rewards.,,,,,,,Mandatory confidential psychological evaluations,,,could condition employment able bodied,nothing good would come risk far outweigh reward,,,,,,,mandatory confidential psychological evaluation,,,could condition employment able bodied nothing good would come risk far outweigh reward       mandatory confidential psychological evaluation  ,0.1265,Positive,United States of America
It isnt relevant to my ability to do the job,Not relevant to my abikity to do the job,I expressed that I had been diagnosed with post partum anxiety. I didnt require any action from my employer,I told them about my anxiety and we discussed going to a counselor and their experiences with it. ,They have told me about their counseling experiences and issues with anxiety,,,,"Build more awareness, promote mental health days, promote work life balance",,,isnt relevant ability job,relevant abikity job,expressed diagnosed post partum anxiety didnt require action employer,told anxiety discussed going counselor experience,told counseling experience issue anxiety,,,,build awareness promote mental health day promote work life balance,,,isnt relevant ability job relevant abikity job expressed diagnosed post partum anxiety didnt require action employer told anxiety discussed going counselor experience told counseling experience issue anxiety    build awareness promote mental health day promote work life balance  ,0.0356,Neutral,Ireland
I shouldn't have to discuss any kind of health issues with a potential employer.,I shouldn't have to discuss any kind of health issues with a potential employer.,,,,I spoke about entering therapy with one of my direct managers.  She was supportive.  Another manager was not supportive and I suspect it may have been a cause for my firing.,"Any coworkers who I've discussed my mental health with have been supportive, with some sharing their own stories.","We were basically trading stories, as mentioned above.","Despite OSMI and Greggy B and everyone else pushing for it, it feels like mental health is still discussed in hushed tones in corners of our industry.  I don't feel comfortable talking about it in person, though I tweet about it often.  This needs t change.",I had a manager who acted as though he was burdened by my therapy schedule.  Eventually I was let go.  I have no way of proving that was why but I have my suspicions.,,shouldnt discus kind health issue potential employer,shouldnt discus kind health issue potential employer,,,,spoke entering therapy one direct manager supportive another manager supportive suspect may cause firing,coworkers ive discussed mental health supportive sharing story,basically trading story mentioned,despite osmi greggy b everyone else pushing feel like mental health still discussed hushed tone corner industry dont feel comfortable talking person though tweet often need change,manager acted though burdened therapy schedule eventually let go way proving suspicion,,shouldnt discus kind health issue potential employer shouldnt discus kind health issue potential employer    spoke entering therapy one direct manager supportive another manager supportive suspect may cause firing coworkers ive discussed mental health supportive sharing story basically trading story mentioned despite osmi greggy b everyone else pushing feel like mental health still discussed hushed tone corner industry dont feel comfortable talking person though tweet often need change manager acted though burdened therapy schedule eventually let go way proving suspicion ,-0.7394,Negative,United States of America
Because it doesn't affect my job performance. I operate on a need to know basis for people I don't know.,Because it doesn't affect my job performance to a noticeable point. I operate on a need to know basis for people I don't know.,,,,,,,"Better insurance for various therapists, support groups, better understanding of the shades of mental illness.",,,doesnt affect job performance operate need know basis people dont know,doesnt affect job performance noticeable point operate need know basis people dont know,,,,,,,better insurance various therapist support group better understanding shade mental illness,,,doesnt affect job performance operate need know basis people dont know doesnt affect job performance noticeable point operate need know basis people dont know       better insurance various therapist support group better understanding shade mental illness  ,-0.5875,Negative,United States of America
Don't want to bring up negatives up front.,Don't want to bring up negatives up front.,,,,,,"Slightly negative, but in an attempt to understand.",Accept that mental health is as normal and important as physical health.,"Manager/CEO talking down and negatively about co-worker, showing no signs of understanding, sympathy, or empathy when co-worker repeatedly needed to stay home. ",,dont want bring negative front,dont want bring negative front,,,,,,slightly negative attempt understand,accept mental health normal important physical health,managerceo talking negatively coworker showing sign understanding sympathy empathy coworker repeatedly needed stay home,,dont want bring negative front dont want bring negative front      slightly negative attempt understand accept mental health normal important physical health managerceo talking negatively coworker showing sign understanding sympathy empathy coworker repeatedly needed stay home ,0.9253,Positive,United States of America
"Depends on what the issue was and what sort of accommodations need to be made. For instance, I have had wrist issues in the past, but do not mention this in interviews, but I do ask for an ergonomic keyboard when I start the new job.","Just as with a physical issue, depends on whether its relevant to the interview -- for example if I had a speech condition, I would probably bring that up preemptively, but something like depression does not seem relevant in the interview process. I would not even mention that once starting unless I needed reasonable accommodations.",,,,,"I was on a very stressful project and discussed the situation with a coworker (who I would also consider a close friend) about my feelings that I was going crazy. Doing so helped quite a bit as they assured me that it was not me, but the environment.","We had a coworker ""snap"" at us in a code review - really become unhinged and make some rather uncalled for comments. One of the other devs came to talk to me about it afterwards. While it was upsetting, I knew the coworker who snapped was going through some personal and substance abuse issues and was able to reassure my compatriot that it wasn't us, it was him, unrelated to the job, and he just needed to work through those issues.","Frankly, I think the industry does a poor job of embracing diverse persons in general -- sure, there are some classes like sexual orientation that do not seem to matter in the industry, but there is a lot of -- maybe not hostility but cool indifference (which might be worse!) to classes that are different from the stereotypical computer science geek -- within that stereotype some mental health conditions like autism might be seen as perfectly acceptable, but something like depression that might call for a strict sleep schedule (no all-nighters for you!) will probably be viewed in a very negative light.",,"It should be noted that some of my previous employment was in sensitive government positions so I heard a fear among coworkers that seeking treatment for mental health conditions might result in termination because they would be deemed as no longer trustworthy. Ironically, it would seem that those are the people who you most want to ensure are in peak mental health. I would be a proponent of standard annual mental health checkups - even incentivize it with HSA credit or such.",depends issue sort accommodation need made instance wrist issue past mention interview ask ergonomic keyboard start new job,physical issue depends whether relevant interview example speech condition would probably bring preemptively something like depression seem relevant interview process would even mention starting unless needed reasonable accommodation,,,,,stressful project discussed situation coworker would also consider close friend feeling going crazy helped quite bit assured environment,coworker snap u code review really become unhinged make rather uncalled comment one devs came talk afterwards upsetting knew coworker snapped going personal substance abuse issue able reassure compatriot wasnt u unrelated job needed work issue,frankly think industry poor job embracing diverse person general sure class like sexual orientation seem matter industry lot maybe hostility cool indifference might worse class different stereotypical computer science geek within stereotype mental health condition like autism might seen perfectly acceptable something like depression might call strict sleep schedule allnighters probably viewed negative light,,noted previous employment sensitive government position heard fear among coworkers seeking treatment mental health condition might result termination would deemed longer trustworthy ironically would seem people want ensure peak mental health would proponent standard annual mental health checkup even incentivize hsa credit,depends issue sort accommodation need made instance wrist issue past mention interview ask ergonomic keyboard start new job physical issue depends whether relevant interview example speech condition would probably bring preemptively something like depression seem relevant interview process would even mention starting unless needed reasonable accommodation     stressful project discussed situation coworker would also consider close friend feeling going crazy helped quite bit assured environment coworker snap u code review really become unhinged make rather uncalled comment one devs came talk afterwards upsetting knew coworker snapped going personal substance abuse issue able reassure compatriot wasnt u unrelated job needed work issue frankly think industry poor job embracing diverse person general sure class like sexual orientation seem matter industry lot maybe hostility cool indifference might worse class different stereotypical computer science geek within stereotype mental health condition like autism might seen perfectly acceptable something like depression might call strict sleep schedule allnighters probably viewed negative light  noted previous employment sensitive government position heard fear among coworkers seeking treatment mental health condition might result termination would deemed longer trustworthy ironically would seem people want ensure peak mental health would proponent standard annual mental health checkup even incentivize hsa credit,-0.6275,Negative,United States of America
I haven't had to but I'm a pretty open person. It would depend if I thought it was relevant.,It wouldn't seem relevant.,,"Mostly I'm just really open about struggling with things like burnout, depression, and anxiety.",It was more of a general casual conversation.,,Again it was more of a casual conversation.,They were open about the therapy and medications they've used.,"Eliminate the stigma and be more upfront with wellness programs and benefits that may be helpful, without you needing to seek them out.",,Nope. Keep up the good work!,havent im pretty open person would depend thought relevant,wouldnt seem relevant,,mostly im really open struggling thing like burnout depression anxiety,general casual conversation,,casual conversation,open therapy medication theyve used,eliminate stigma upfront wellness program benefit may helpful without needing seek,,nope keep good work,havent im pretty open person would depend thought relevant wouldnt seem relevant  mostly im really open struggling thing like burnout depression anxiety general casual conversation  casual conversation open therapy medication theyve used eliminate stigma upfront wellness program benefit may helpful without needing seek  nope keep good work,0.0741,Positive,United States of America
,,"Comes up all the time. We have a slack channel about mental health, discuss it with my manager in 1:1s, ceo sent a couple emails about it",,,,,,"Overvalues behaviors that lead to burnout, machoness, and anti-social behaviors","Depression & anxiety induced by a problematic product manager was not taken seriously, I was ignored and the abuser was promoted",Just observed that this is very thorough but didn’t ask questions about whether I have noticed or be talked to about the mental health of my colleagues and what I’ve witnessed working with them,,,come time slack channel mental health discus manager ceo sent couple email,,,,,,overvalues behavior lead burnout machoness antisocial behavior,depression anxiety induced problematic product manager taken seriously ignored abuser promoted,observed thorough didnt ask question whether noticed talked mental health colleague ive witnessed working,  come time slack channel mental health discus manager ceo sent couple email      overvalues behavior lead burnout machoness antisocial behavior depression anxiety induced problematic product manager taken seriously ignored abuser promoted observed thorough didnt ask question whether noticed talked mental health colleague ive witnessed working,-0.9022,Negative,United States of America
It's important to inform your employer about any medical condition that you might have so they can provide you with everything you need to perform your job well.,See previous response.,,,,,,,"Medical issues, in some way or the other,  affect us all. Any employer should give due attention to the overall health of it's people. This should be part of the benefits scheme of every employer.",,,important inform employer medical condition might provide everything need perform job well,see previous response,,,,,,,medical issue way affect u employer give due attention overall health people part benefit scheme every employer,,,important inform employer medical condition might provide everything need perform job well see previous response       medical issue way affect u employer give due attention overall health people part benefit scheme every employer  ,0.7096,Positive,United States of America
depends on the nature of it and whether it would affect anything,see above,,,,,,no,.,,.,depends nature whether would affect anything,see,,,,,,,,,,depends nature whether would affect anything see         ,0,Neutral,United States of America
If i'm not fit then i'm going to need a lot of sick leaves so that's why i would like to clear the air in the beginning itself. ,If i told them that i have mental health issue then they might not wanna hire me. ,,,,,,,Conduct awareness related towards health and pump them to have a healthy life style with exercise and all.,,You guys already covered too much. End this survey already. :P,im fit im going need lot sick leaf thats would like clear air beginning,told mental health issue might wan na hire,,,,,,,conduct awareness related towards health pump healthy life style exercise,,guy already covered much end survey already p,im fit im going need lot sick leaf thats would like clear air beginning told mental health issue might wan na hire       conduct awareness related towards health pump healthy life style exercise  guy already covered much end survey already p,0.7184,Positive,United States of America
,"""not proffessional"" ",,,,,,,,,,,proffessional,,,,,,,,,, proffessional         ,0,Neutral,United States of America
I am afraid it would affect my first impression.,,,,,,,,,,,afraid would affect first impression,,,,,,,,,,,afraid would affect first impression          ,0.2263,Positive,United States of America
"I don't know. If it's not a big deal like small-medium injury from sports or something like that, I wouldn't bring it up. Things like cardiovascular problems could be brought up just to let people know that if something happens, they know what to do.","Unlike physical health, mental health isn't quite noticeable in public. I believe it takes less time to recover from a mental health issue than a physical one. I'm saying this because sometimes I feel anxious about things, and I've gone and done the things that make me feel anxious, which resulted in me feeling good. So in my opinion, it's all about how we handle things emotionally. Physically... you can't do much when your leg is broken. Just rest. I hope you, whoever is reading this, get my point.",,,,,,,"As an engineer, money does make a difference. But not as much as the work conditions. Toxic environments are in no way good for anyone. Team-building trips every few months could be one way to help improve the relationships each person has with their coworkers.",,"Do you hand out free swag?
@darkoefremov on twitter, hit me up.",dont know big deal like smallmedium injury sport something like wouldnt bring thing like cardiovascular problem could brought let people know something happens know,unlike physical health mental health isnt quite noticeable public believe take less time recover mental health issue physical one im saying sometimes feel anxious thing ive gone done thing make feel anxious resulted feeling good opinion handle thing emotionally physically cant much leg broken rest hope whoever reading get point,,,,,,,engineer money make difference much work condition toxic environment way good anyone teambuilding trip every month could one way help improve relationship person coworkers,,hand free swag darkoefremov twitter hit,dont know big deal like smallmedium injury sport something like wouldnt bring thing like cardiovascular problem could brought let people know something happens know unlike physical health mental health isnt quite noticeable public believe take less time recover mental health issue physical one im saying sometimes feel anxious thing ive gone done thing make feel anxious resulted feeling good opinion handle thing emotionally physically cant much leg broken rest hope whoever reading get point       engineer money make difference much work condition toxic environment way good anyone teambuilding trip every month could one way help improve relationship person coworkers  hand free swag darkoefremov twitter hit,0.9676,Positive,United States of America
,It just isn't something that I'm comfortable discussing.,"The discussion only came about because I felt like I was being accused of being the cause of tension in my department. Nothing came from the conversation, and the topic hasn't come up since.",Another co-worker has similar mental health issues. We have talked about them from time to time but not in depth.,Same as previous answer.,,,,,,,,isnt something im comfortable discussing,discussion came felt like accused cause tension department nothing came conversation topic hasnt come since,another coworker similar mental health issue talked time time depth,previous answer,,,,,,, isnt something im comfortable discussing discussion came felt like accused cause tension department nothing came conversation topic hasnt come since another coworker similar mental health issue talked time time depth previous answer      ,-0.5722,Negative,United States of America
"i live in Mexico and here we do not have a culture about physical health, neverless there is a federal regulations, recruiters are not traided in a real human care","in mexico employers does not have an inclusive culture, our human care philosophy is really limited",,,,,related about stress and rage controll,"stress, and frustration control","they need to create a real human care culture, not just try to fulfill legal regulations","from my manager, he recommended me to be a more friendly person, is not easy to me honestly",not really,live mexico culture physical health neverless federal regulation recruiter traided real human care,mexico employer inclusive culture human care philosophy really limited,,,,,related stress rage controll,stress frustration control,need create real human care culture try fulfill legal regulation,manager recommended friendly person easy honestly,really,live mexico culture physical health neverless federal regulation recruiter traided real human care mexico employer inclusive culture human care philosophy really limited     related stress rage controll stress frustration control need create real human care culture try fulfill legal regulation manager recommended friendly person easy honestly really,0.8744,Positive,United States of America
"It would be used as a basis for rejecting me as a candidate for employment, whether officially or unofficially.","It would be used as a basis for rejecting me as a candidate for employment, whether officially or unofficially.",,,,,,,"Awareness is a great start. It would be helpful to have some best practices for the *people* , especially those involved with being oncall and the PTSD like symptoms involved such is cringing when their or others phones ring, cringing when hearing key words like down, broken, severity, and others associated with a loss of service and the accompanying responses from users, customers, and management. I have seen some companies attempt to mitigate the effects by giving the employee(s) a day off at the end of the oncall rotation, or offering at least comp time for any off hour outages, but some standards like these being published so they can be referenced by other IT professionals would go a long way as a tool to those attempting to improve the situation from within their organizations.","Team lead is very disrespectful of other people in general, in a practical sense. Leadership even jokes about his responses.",,would used basis rejecting candidate employment whether officially unofficially,would used basis rejecting candidate employment whether officially unofficially,,,,,,,awareness great start would helpful best practice people especially involved oncall ptsd like symptom involved cringing others phone ring cringing hearing key word like broken severity others associated loss service accompanying response user customer management seen company attempt mitigate effect giving employee day end oncall rotation offering least comp time hour outage standard like published referenced professional would go long way tool attempting improve situation within organization,team lead disrespectful people general practical sense leadership even joke response,,would used basis rejecting candidate employment whether officially unofficially would used basis rejecting candidate employment whether officially unofficially       awareness great start would helpful best practice people especially involved oncall ptsd like symptom involved cringing others phone ring cringing hearing key word like broken severity others associated loss service accompanying response user customer management seen company attempt mitigate effect giving employee day end oncall rotation offering least comp time hour outage standard like published referenced professional would go long way tool attempting improve situation within organization team lead disrespectful people general practical sense leadership even joke response ,0.9287,Positive,United States of America
Not their business.,Not their business.,,,,,,,work/life balance,,,business,business,,,,,,,worklife balance,,,business business       worklife balance  ,0,Neutral,United States of America
