"I would not want to come across as a complainer, I wouldn't want that to cost me the job.","While I think we've made a lot of progress in accepting mental health issues and being more open about them, I still think there is a heavy negative bias. If it came down to me and another equally qualified candidate, I wouldn't want to worry that my mental illness cost me a job. I wouldn't want to be seen as a liability. Also due to my previous negative experience with being open with a manager about my mental health issues, I'm much less likely to open up to anyone in a position of power about it at work. The manager was initially supportive, but later used my conditions to insult and degrade me.",,,,Once i chose to confide in a manager about my battle with major depression and recovery from addiction/alcoholism. They later threw it in my face when I decided to quit and used my past honesty to insult me.,"I became close enough to consider some of my past coworkers friends. I was able to open up to them about medications I was taking, seeing a therapist, and the struggles I was going through. These friends were very supportive, some ended up asking for advice about getting their own therapy. It was really a relief to have people I could trust and be honest with at work, if I was feeling extra bad on some days.","One coworker used to tell me about his experiences with anxiety-- we considered each others friends by this time. Another former manager who moved into another department opened up about his recovery from addiction, which allowed me to speak to him about my own experience. It was helpful to have someone at work who could understand me in that regard.",State explicit support for taking sick days for mental health issues. State explicit support for employees who are dealing with mental health issues and say that they are just as important as physical health issues. Offer health insurance plans that subsidize or cover mental health. Be more aware of addiction/alcoholism recovery and be more sensitive/sensible with work events.,"One manager at a previous job opened up to me about being in recovery from alcoholism/addiction, and so I opened up to them about it. Unfortunately, this first manager moved into another department and I got a new manager. I decided to be open with the new manager both about my recovery status and having major depression. At first they were supportive. Then, when I decided to quit, they said a lot of extremely hurtful things including calling me lazy, saying that I wanted people to hold my hand, and many condescending comments such as ""Are you sure you should really quit your job right now with your 'condition'?"" all which essentially resulted in gaslighting, since they tried to refute every reason I listed for quitting by saying it was all my fault.","In germany at least, compared to the USA, doctors notes are extremely respected and must be accepted for days off. The employer never knows the reason for the doctor's note and they can't force employees to work. I used to live in the USA and always had a hard time getting sick days at all, and worrying about the reason was a major source of stress. It's at least easier to take mental health days discreetly in Germany, which adds a lot of comfort to my life.",would want come across complainer wouldnt want cost job,think weve made lot progress accepting mental health issue open still think heavy negative bias came another equally qualified candidate wouldnt want worry mental illness cost job wouldnt want seen liability also due previous negative experience open manager mental health issue im much less likely open anyone position power work manager initially supportive later used condition insult degrade,,,,chose confide manager battle major depression recovery addictionalcoholism later threw face decided quit used past honesty insult,became close enough consider past coworkers friend able open medication taking seeing therapist struggle going friend supportive ended asking advice getting therapy really relief people could trust honest work feeling extra bad day,one coworker used tell experience anxiety considered others friend time another former manager moved another department opened recovery addiction allowed speak experience helpful someone work could understand regard,state explicit support taking sick day mental health issue state explicit support employee dealing mental health issue say important physical health issue offer health insurance plan subsidize cover mental health aware addictionalcoholism recovery sensitivesensible work event,one manager previous job opened recovery alcoholismaddiction opened unfortunately first manager moved another department got new manager decided open new manager recovery status major depression first supportive decided quit said lot extremely hurtful thing including calling lazy saying wanted people hold hand many condescending comment sure really quit job right condition essentially resulted gaslighting since tried refute every reason listed quitting saying fault,germany least compared usa doctor note extremely respected must accepted day employer never know reason doctor note cant force employee work used live usa always hard time getting sick day worrying reason major source stress least easier take mental health day discreetly germany add lot comfort life,would want come across complainer wouldnt want cost job think weve made lot progress accepting mental health issue open still think heavy negative bias came another equally qualified candidate wouldnt want worry mental illness cost job wouldnt want seen liability also due previous negative experience open manager mental health issue im much less likely open anyone position power work manager initially supportive later used condition insult degrade    chose confide manager battle major depression recovery addictionalcoholism later threw face decided quit used past honesty insult became close enough consider past coworkers friend able open medication taking seeing therapist struggle going friend supportive ended asking advice getting therapy really relief people could trust honest work feeling extra bad day one coworker used tell experience anxiety considered others friend time another former manager moved another department opened recovery addiction allowed speak experience helpful someone work could understand regard state explicit support taking sick day mental health issue state explicit support employee dealing mental health issue say important physical health issue offer health insurance plan subsidize cover mental health aware addictionalcoholism recovery sensitivesensible work event one manager previous job opened recovery alcoholismaddiction opened unfortunately first manager moved another department got new manager decided open new manager recovery status major depression first supportive decided quit said lot extremely hurtful thing including calling lazy saying wanted people hold hand many condescending comment sure really quit job right condition essentially resulted gaslighting since tried refute every reason listed quitting saying fault germany least compared usa doctor note extremely respected must accepted day employer never know reason doctor note cant force employee work used live usa always hard time getting sick day worrying reason major source stress least easier take mental health day discreetly germany add lot comfort life,-0.5964,Negative,United States of America
"It would depend on the job and the circumstance. If I felt that it wouldn’t interfere with the job or my coworkers, then I might not bring it up in an interview. If I felt it would affect my work or my coworkers jobs, then yes, I’d bring it up.",I feel like there’s still lots of stigma surrounding mental health issues and mood disorders. I would worry that it would negatively affect my interviewers perception of me and my ability to do good work...ironically I suppose I’m also contributing to this stigma by not being open to discussing my mental health in an interview.,,,,,"Telling a few coworkers that I saw a therapist, both to break down stigma and to help encourage them to get some support surrounding mental health. One coworker had a lot of questions. Another said they wanted to go to therapy, but the cost was prohibitive & didn’t seem to want to look into subsidized/sliding scale options. ",,,,,would depend job circumstance felt wouldnt interfere job coworkers might bring interview felt would affect work coworkers job yes id bring,feel like there still lot stigma surrounding mental health issue mood disorder would worry would negatively affect interviewer perception ability good workironically suppose im also contributing stigma open discussing mental health interview,,,,,telling coworkers saw therapist break stigma help encourage get support surrounding mental health one coworker lot question another said wanted go therapy cost prohibitive didnt seem want look subsidizedsliding scale option,,,,,would depend job circumstance felt wouldnt interfere job coworkers might bring interview felt would affect work coworkers job yes id bring feel like there still lot stigma surrounding mental health issue mood disorder would worry would negatively affect interviewer perception ability good workironically suppose im also contributing stigma open discussing mental health interview     telling coworkers saw therapist break stigma help encourage get support surrounding mental health one coworker lot question another said wanted go therapy cost prohibitive didnt seem want look subsidizedsliding scale option    ,0.9058,Positive,United States of America
I'm not comfortable talking about health issues during interviews.,I'm not comfortable talking about health issues during interviews.,"I was starting to have panic attacks daily due to the stressors I was seeing at work. My manager disregarded my concerns until I had to go to the ER because I thought I was having a heart attack, and had me take a day off that generously ""didn't count towards my PTO."" I had roughly 5 meetings with him describing what was going on, and that I needed help, but none was offered. I've submitted my notice at this role, and found that there are no mental health policies put into place, nor coverage.",,,,"I was feeling a bit overwhelmed with new responsibilities, and they directed me to OSMI. They also advised me to talk to my HR team directly, as they had partnered with Cognitive Behavioral Therapists and I could have taken sessions if I found it to get worse.",,"Talk about it early and often, as part of company meetings, normalize conversations around mental health. Describe the process end to end what it would look like to ask for help.","My manager basically told me that I'm acting very naive and immature, and that all management roles are stressful, that I just need to man up.",No,im comfortable talking health issue interview,im comfortable talking health issue interview,starting panic attack daily due stressor seeing work manager disregarded concern go er thought heart attack take day generously didnt count towards pto roughly meeting describing going needed help none offered ive submitted notice role found mental health policy put place coverage,,,,feeling bit overwhelmed new responsibility directed osmi also advised talk hr team directly partnered cognitive behavioral therapist could taken session found get worse,,talk early often part company meeting normalize conversation around mental health describe process end end would look like ask help,manager basically told im acting naive immature management role stressful need man,,im comfortable talking health issue interview im comfortable talking health issue interview starting panic attack daily due stressor seeing work manager disregarded concern go er thought heart attack take day generously didnt count towards pto roughly meeting describing going needed help none offered ive submitted notice role found mental health policy put place coverage    feeling bit overwhelmed new responsibility directed osmi also advised talk hr team directly partnered cognitive behavioral therapist could taken session found get worse  talk early often part company meeting normalize conversation around mental health describe process end end would look like ask help manager basically told im acting naive immature management role stressful need man ,-0.6597,Negative,United Kingdom
Not really appropriate for the context of an interview. ,Not really applicable before an interview; I could only see a negative impact.,"I told my manager I was starting antidepressants. He seemed surprised and concerned, and asked if there was anything he could do. Was very understanding that I might need to work from home or take more sick days.",,,,,,"It's not discussed very much. Additionally, the tech industry as a whole is ripe with potential to exacerbate issues for minority workers.",,,really appropriate context interview,really applicable interview could see negative impact,told manager starting antidepressant seemed surprised concerned asked anything could understanding might need work home take sick day,,,,,,discussed much additionally tech industry whole ripe potential exacerbate issue minority worker,,,really appropriate context interview really applicable interview could see negative impact told manager starting antidepressant seemed surprised concerned asked anything could understanding might need work home take sick day      discussed much additionally tech industry whole ripe potential exacerbate issue minority worker  ,-0.7269,Negative,United States of America
"It's not worth the risk that they react badly. And if I'm not obliged to tell them, I'd prefer to keep it private","It's not worth the risk that they react badly. And if I'm not obliged to tell them, I'd prefer to keep it private",,"I have talked casually about burnout, anxiety and depression with my coworkers. They have generally reacted positively.",I have had coworkers mention struggling with depressive episodes. And other coworkers mention issues with insomnia.,,,,Normalizing more healthy work habits. Too many employers talk positively about mental health but still promote unhealthy work hours and habits,,,worth risk react badly im obliged tell id prefer keep private,worth risk react badly im obliged tell id prefer keep private,,talked casually burnout anxiety depression coworkers generally reacted positively,coworkers mention struggling depressive episode coworkers mention issue insomnia,,,,normalizing healthy work habit many employer talk positively mental health still promote unhealthy work hour habit,,,worth risk react badly im obliged tell id prefer keep private worth risk react badly im obliged tell id prefer keep private  talked casually burnout anxiety depression coworkers generally reacted positively coworkers mention struggling depressive episode coworkers mention issue insomnia    normalizing healthy work habit many employer talk positively mental health still promote unhealthy work hour habit  ,-0.7906,Negative,United States of America
"Employers are more accepting and accommodating of physical issues, but there is still some stigma around them.",I feel like I would be discriminated against more with a mental health issue. ,,,,,,,Promote mental health more and allow employees to take mental health days. Allow much more PTO or a generous work from home policy. Let people step away from the stresses of work more frequently to improve their mental health.,,,employer accepting accommodating physical issue still stigma around,feel like would discriminated mental health issue,,,,,,,promote mental health allow employee take mental health day allow much pto generous work home policy let people step away stress work frequently improve mental health,,,employer accepting accommodating physical issue still stigma around feel like would discriminated mental health issue       promote mental health allow employee take mental health day allow much pto generous work home policy let people step away stress work frequently improve mental health  ,0.9169,Positive,United States of America
"I think people are more ""accepting"" of physical health issues than they are mental health issues because there is a perception of futility with regards to physical health. (ie - ""Oh, you're missing a leg, well I can't help you with that"")","Mental health issues are still very frowned upon or not easily talked about in the US, and many people are not comfortable talking about it. I fear that if I were to bring it up during an interview, it may affect my chances of obtaining an offer.","I had mentioned to my employer that I have depression and that it can sometimes impact my performance. They said they understood, and then told me that the ""solution"" was simply to start maintaining a schedule and then the depression would go away...","I've spoken to coworkers about depression in a broad sense and mentioned that I have depression, and the response was (pretty much), ""Yeah, that doesn't surprise me""",,"At a previous company, I had a co-worker who was a bully to me and who would berate me and undermine me in all of our meetings. I had brought this up both to the co-worker and to my manager, but my manager dismissed it because my co-worker was a woman. I brought the issue up to HR and they told me that the company will pay for up to 3 sessions with a counselor if I felt I needed it. I did use the 3 sessions, but I later found out that my manager had told my team that I had started going to therapy. I left the company shortly afterwards.","I've spoken to co-workers who did not work on the same team as I did. I would even call these co-workers friends. When speaking to them about my depression, they seemed to be understanding and empathetic to my situation.",,"For starters, be aware of what mental health entails/encompasses. Learn how it is that an employer can help, or support someone with mental health issues. Finally, be understanding/endorsing of ""mental health days"". My brain is my toolbox as a software engineer, sometimes I need a day just to polish the rust off.","I have mentioned my depression to co-workers, and one of my colleagues said, ""Suck it up, buttercup""","It might be interesting to ask, ""Does your company allow for sick days to be used for 'Mental Health Days'?""",think people accepting physical health issue mental health issue perception futility regard physical health ie oh youre missing leg well cant help,mental health issue still frowned upon easily talked u many people comfortable talking fear bring interview may affect chance obtaining offer,mentioned employer depression sometimes impact performance said understood told solution simply start maintaining schedule depression would go away,ive spoken coworkers depression broad sense mentioned depression response pretty much yeah doesnt surprise,,previous company coworker bully would berate undermine meeting brought coworker manager manager dismissed coworker woman brought issue hr told company pay session counselor felt needed use session later found manager told team started going therapy left company shortly afterwards,ive spoken coworkers work team would even call coworkers friend speaking depression seemed understanding empathetic situation,,starter aware mental health entailsencompasses learn employer help support someone mental health issue finally understandingendorsing mental health day brain toolbox software engineer sometimes need day polish rust,mentioned depression coworkers one colleague said suck buttercup,might interesting ask company allow sick day used mental health day,think people accepting physical health issue mental health issue perception futility regard physical health ie oh youre missing leg well cant help mental health issue still frowned upon easily talked u many people comfortable talking fear bring interview may affect chance obtaining offer mentioned employer depression sometimes impact performance said understood told solution simply start maintaining schedule depression would go away ive spoken coworkers depression broad sense mentioned depression response pretty much yeah doesnt surprise  previous company coworker bully would berate undermine meeting brought coworker manager manager dismissed coworker woman brought issue hr told company pay session counselor felt needed use session later found manager told team started going therapy left company shortly afterwards ive spoken coworkers work team would even call coworkers friend speaking depression seemed understanding empathetic situation  starter aware mental health entailsencompasses learn employer help support someone mental health issue finally understandingendorsing mental health day brain toolbox software engineer sometimes need day polish rust mentioned depression coworkers one colleague said suck buttercup might interesting ask company allow sick day used mental health day,-0.9396,Negative,United States of America
Fear of it being leveraged against me in negotiations or candidacy,Fear of it being leveraged against me as a potential candidate,,,,,Discussed having a therapist and general mental health,Having a therapist and general mental health,,,,fear leveraged negotiation candidacy,fear leveraged potential candidate,,,,,discussed therapist general mental health,therapist general mental health,,,,fear leveraged negotiation candidacy fear leveraged potential candidate     discussed therapist general mental health therapist general mental health   ,-0.7506,Negative,United States of America
I would be afraid that it would disqualify me from the position.,"I feel like I would be stigmatized. I'm already a minority, and adding any kind of mental illness to that aspect would not reflect positively on me.",I talked with my direct manager about anxiety and stress that I was experiencing. They suggested I see a therapist.,,"My coworker has been very open about their current mental health issues, and talks about things they discover in therapy",,,,"The industry encourages long hours, an unhealthy work/life balance, and perfection. Having time off and encouraging taking time off for employees would be a step in the right direction - it might lead to temporary losses (1 less person to work on a project), but would be beneficial for all parties involved in the long run.",,,would afraid would disqualify position,feel like would stigmatized im already minority adding kind mental illness aspect would reflect positively,talked direct manager anxiety stress experiencing suggested see therapist,,coworker open current mental health issue talk thing discover therapy,,,,industry encourages long hour unhealthy worklife balance perfection time encouraging taking time employee would step right direction might lead temporary loss less person work project would beneficial party involved long run,,,would afraid would disqualify position feel like would stigmatized im already minority adding kind mental illness aspect would reflect positively talked direct manager anxiety stress experiencing suggested see therapist  coworker open current mental health issue talk thing discover therapy    industry encourages long hour unhealthy worklife balance perfection time encouraging taking time employee would step right direction might lead temporary loss less person work project would beneficial party involved long run  ,0.9186,Positive,United States of America
